{
  "schemaVersion": 1,
  "generatedAt": "2026-10-30T10:15:27.278Z",
  "channel": "stable",
  "categories": [
    "效率",
    "开发",
    "设计",
    "媒体",
    "其它"
  ],
  "plugins": [
    {
      "id": "com.github.eNest.ai-canvas",
      "name": "AI 画布",
      "version": "0.0.1",
      "description": "AI 视觉工作台：手绘风节点画布编排文生图、图生图与提示词工作流，端口点击即建节点，标准输出协议与变量引用，OpenAI Images 协议自定义接入，生成图自动入库画廊。",
      "author": "eNest Labs",
      "category": "设计",
      "icon": "https://github.com/hyqf98/eNest_plugin/releases/download/v0.0.1/ai-canvas%400.0.1-icon.svg",
      "readmeUrl": "https://github.com/hyqf98/eNest_plugin/releases/download/v0.0.1/ai-canvas%400.0.1-README.md",
      "screenshots": [
        "https://github.com/hyqf98/eNest_plugin/releases/download/v0.0.1/ai-canvas%400.0.1-screenshot-1.png"
      ],
      "tags": [
        "AI 绘画",
        "节点编排",
        "gpt-image",
        "手绘"
      ],
      "permissions": [
        "net.fetch",
        "backend.node"
      ],
      "engines": {
        "enest": ">=0.0.1"
      },
      "featured": false,
      "ui": {
        "chrome": "none",
        "themeAware": true,
        "background": "opaque",
        "preferredColorScheme": "auto"
      },
      "asset": {
        "name": "ai-canvas@0.0.1.enestplugin",
        "url": "https://github.com/hyqf98/eNest_plugin/releases/download/v0.0.1/ai-canvas%400.0.1.enestplugin",
        "size": 4345679,
        "sha256": "4c77cbd8e1f7d6ebdd35bbf379568414526284c614c9293854d90f2a10624853"
      },
      "readmeImages": {}
    },
    {
      "id": "com.github.eNest.anything",
      "name": "Anything 文件搜索",
      "version": "0.0.1",
      "description": "全盘文件即时搜索：Spotlight / Everything 引擎，关键词高亮、排序分页、文本与图片预览，打开、定位、移入废纸篓。",
      "author": "eNest Labs",
      "category": "效率",
      "icon": "https://github.com/hyqf98/eNest_plugin/releases/download/v0.0.1/anything%400.0.1-icon.svg",
      "readmeUrl": "https://github.com/hyqf98/eNest_plugin/releases/download/v0.0.1/anything%400.0.1-README.md",
      "screenshots": [
        "https://github.com/hyqf98/eNest_plugin/releases/download/v0.0.1/anything%400.0.1-screenshot-1.png"
      ],
      "tags": [
        "文件搜索",
        "Spotlight",
        "Everything",
        "效率"
      ],
      "permissions": [
        "backend.node",
        "contribute",
        "clipboard.write",
        "shell.openExternal"
      ],
      "engines": {
        "enest": ">=0.0.1"
      },
      "featured": false,
      "ui": {
        "chrome": "none",
        "themeAware": true,
        "background": "transparent",
        "preferredColorScheme": "auto"
      },
      "asset": {
        "name": "anything@0.0.1.enestplugin",
        "url": "https://github.com/hyqf98/eNest_plugin/releases/download/v0.0.1/anything%400.0.1.enestplugin",
        "size": 177717,
        "sha256": "56d11b6275e5aa7ca752aca257683ec304c9436729268d017876cff7344d51ba"
      },
      "readmeImages": {}
    },
    {
      "id": "com.github.eNest.batch-rename",
      "name": "批量重命名",
      "version": "0.0.1",
      "description": "拖入多文件，查找替换（正则）/ 序号 / 日期 / 大小写 / 插入 / 删除片段 / 扩展名规则链实时预览（diff 高亮 + 冲突检测），确认后批量改名，支持撤销。",
      "author": "eNest Labs",
      "category": "其它",
      "icon": "https://github.com/hyqf98/eNest_plugin/releases/download/v0.0.1/batch-rename%400.0.1-icon.svg",
      "readmeUrl": "https://github.com/hyqf98/eNest_plugin/releases/download/v0.0.1/batch-rename%400.0.1-README.md",
      "screenshots": [
        "https://github.com/hyqf98/eNest_plugin/releases/download/v0.0.1/batch-rename%400.0.1-screenshot-1.png"
      ],
      "tags": [
        "重命名",
        "批量",
        "文件"
      ],
      "permissions": [
        "fs.rename"
      ],
      "engines": {
        "enest": ">=0.0.1"
      },
      "featured": false,
      "ui": {
        "chrome": "none",
        "themeAware": true,
        "background": "opaque",
        "preferredColorScheme": "auto"
      },
      "asset": {
        "name": "batch-rename@0.0.1.enestplugin",
        "url": "https://github.com/hyqf98/eNest_plugin/releases/download/v0.0.1/batch-rename%400.0.1.enestplugin",
        "size": 117493,
        "sha256": "e6bdead39eb24c3cc708206fc10a78ad5aba5e1cce57b6f081f9955723c58f2e"
      },
      "readmeImages": {
        "./screenshots/01-main.png": "https://github.com/hyqf98/eNest_plugin/releases/download/v0.0.1/batch-rename%400.0.1-screenshot-1.png"
      }
    },
    {
      "id": "com.github.eNest.calculator",
      "name": "计算器",
      "version": "0.0.1",
      "description": "科学计算、变量赋值、Ans 与内存寄存器、百分比双语义、千分位显示、可收藏的本地计算历史。",
      "author": "eNest Labs",
      "category": "效率",
      "icon": "https://github.com/hyqf98/eNest_plugin/releases/download/v0.0.1/calculator%400.0.1-icon.svg",
      "readmeUrl": "https://github.com/hyqf98/eNest_plugin/releases/download/v0.0.1/calculator%400.0.1-README.md",
      "screenshots": [
        "https://github.com/hyqf98/eNest_plugin/releases/download/v0.0.1/calculator%400.0.1-screenshot-1.png"
      ],
      "tags": [
        "计算器",
        "效率"
      ],
      "permissions": [
        "clipboard.write",
        "shell.openExternal"
      ],
      "engines": {
        "enest": ">=0.0.1"
      },
      "featured": false,
      "ui": {
        "chrome": "none",
        "themeAware": true,
        "background": "transparent",
        "preferredColorScheme": "auto"
      },
      "asset": {
        "name": "calculator@0.0.1.enestplugin",
        "url": "https://github.com/hyqf98/eNest_plugin/releases/download/v0.0.1/calculator%400.0.1.enestplugin",
        "size": 152833,
        "sha256": "749255547c6d95b47adc09af99e56a46028ff3542b2e25a914c49ea53ea27d79"
      },
      "readmeImages": {
        "./screenshots/01-main.png": "https://github.com/hyqf98/eNest_plugin/releases/download/v0.0.1/calculator%400.0.1-screenshot-1.png"
      }
    },
    {
      "id": "com.github.eNest.ccswitch",
      "name": "供应商切换",
      "version": "0.0.1",
      "description": "AI CLI 供应商切换台：10 应用配置管理、50+ 预设、切换历史与回退、全量备份、MCP 同步、会话浏览与用量统计（复刻 cc-switch）",
      "author": "eNest Labs",
      "category": "开发",
      "icon": "https://github.com/hyqf98/eNest_plugin/releases/download/v0.0.1/ccswitch%400.0.1-icon.svg",
      "readmeUrl": "https://github.com/hyqf98/eNest_plugin/releases/download/v0.0.1/ccswitch%400.0.1-README.md",
      "screenshots": [
        "https://github.com/hyqf98/eNest_plugin/releases/download/v0.0.1/ccswitch%400.0.1-screenshot-1.png"
      ],
      "tags": [
        "AI",
        "供应商",
        "MCP",
        "Claude",
        "Codex",
        "开发"
      ],
      "permissions": [
        "net.fetch",
        "hotkey",
        "notify",
        "clipboard.write",
        "shell.openExternal",
        "contribute",
        "backend.node"
      ],
      "engines": {
        "enest": ">=0.0.1"
      },
      "featured": false,
      "ui": {
        "chrome": "none",
        "themeAware": true,
        "background": "opaque",
        "preferredColorScheme": "auto"
      },
      "asset": {
        "name": "ccswitch@0.0.1.enestplugin",
        "url": "https://github.com/hyqf98/eNest_plugin/releases/download/v0.0.1/ccswitch%400.0.1.enestplugin",
        "size": 195820,
        "sha256": "80d7728915b8afaafb09f4d214cc0374642b7e31e77e690ea41b765e03b42e67"
      },
      "readmeImages": {
        "./screenshots/01-main.png": "https://github.com/hyqf98/eNest_plugin/releases/download/v0.0.1/ccswitch%400.0.1-screenshot-1.png"
      }
    },
    {
      "id": "com.github.eNest.clipboard",
      "name": "剪贴板",
      "version": "0.0.1",
      "description": "搜索文本、图片与文件历史；快捷回贴，文本变换工具条与暂存片段，批量整理。",
      "author": "eNest Labs",
      "category": "效率",
      "icon": "https://github.com/hyqf98/eNest_plugin/releases/download/v0.0.1/clipboard%400.0.1-icon.svg",
      "readmeUrl": "https://github.com/hyqf98/eNest_plugin/releases/download/v0.0.1/clipboard%400.0.1-README.md",
      "screenshots": [
        "https://github.com/hyqf98/eNest_plugin/releases/download/v0.0.1/clipboard%400.0.1-screenshot-1.png",
        "https://github.com/hyqf98/eNest_plugin/releases/download/v0.0.1/clipboard%400.0.1-screenshot-2.webp",
        "https://github.com/hyqf98/eNest_plugin/releases/download/v0.0.1/clipboard%400.0.1-screenshot-3.webp"
      ],
      "tags": [
        "剪贴板",
        "历史",
        "效率"
      ],
      "permissions": [
        "clipboard.read",
        "clipboard.write",
        "clipboard.readImage",
        "clipboard.writeImage",
        "clipboard.history",
        "clipboard.paste"
      ],
      "engines": {
        "enest": ">=0.0.1"
      },
      "featured": true,
      "ui": {
        "chrome": "none",
        "themeAware": true,
        "background": "transparent",
        "preferredColorScheme": "auto"
      },
      "asset": {
        "name": "clipboard@0.0.1.enestplugin",
        "url": "https://github.com/hyqf98/eNest_plugin/releases/download/v0.0.1/clipboard%400.0.1.enestplugin",
        "size": 266287,
        "sha256": "d95f86efba0dda38c8e6b537db7437fb55a480446afdd229069c01c0a80d9c98"
      },
      "readmeImages": {
        "./screenshots/01-main.png": "https://github.com/hyqf98/eNest_plugin/releases/download/v0.0.1/clipboard%400.0.1-screenshot-1.png"
      }
    },
    {
      "id": "com.github.eNest.codec",
      "name": "编解码",
      "version": "0.0.1",
      "description": "Base64、URL、Hex、Unicode、HTML 编解码与 JWT、URL 参数、Data URL 查看；逐行批量、错误定位、文件转 Data URL、最近转换记录。",
      "author": "eNest Labs",
      "category": "开发",
      "icon": "https://github.com/hyqf98/eNest_plugin/releases/download/v0.0.1/codec%400.0.1-icon.svg",
      "readmeUrl": "https://github.com/hyqf98/eNest_plugin/releases/download/v0.0.1/codec%400.0.1-README.md",
      "screenshots": [
        "https://github.com/hyqf98/eNest_plugin/releases/download/v0.0.1/codec%400.0.1-screenshot-1.png"
      ],
      "tags": [
        "base64",
        "url",
        "hex",
        "开发"
      ],
      "permissions": [
        "clipboard.read",
        "clipboard.write",
        "shell.openExternal"